nombre,version,cal_general,cal_acabados,cal_seguridad,cal_equipamiento,cal_Infotenimiento,cal_comportamiento,cal_motor,cal_transmision,cal_consumo,cal_espacio,cal_precio,a_favor,en_contra
Audi TTS ,TTS TFSI Quattro,8.6,10,8.5,10,10,9,9,10,7.5,4,8,"Su diseño ya es todo un ícono.,Es rápido, preciso y fácil de controlar.,Los acabados interiores son dignos del calificativo premium.","Los asientos traseros son casi de adorno.,No lleva de serie ninguna asistencia de conducción.,En México ya no se vende el TT ""a secas"" con versiones más accesibles."
,,,,,,,,,,,,,,
MINI John Cooper Works GP ,GP,8.4,8.5,8,8,10,10,10,10,7,5,7,"Es un MINI muy cercano a un auto de carreras.,Sorprende su capacidad de soportar aceleración lateral.,Está bien diferenciado de un JCW tradicional.","Es demasiado rígido para el día a día.,No lleva cámara de reversa ni llave inteligente.,Es una edición limitada que ya se agotó en México."
,,7.92,"8.7,8.4,8.9","8.1,7.9,8.8","7.4,7.7,8.3","7.5,7.5,10","7.7,9.1,7.5","8.1,7.9,7.9","8.0,8.3,8.3","7.0,7.7,7.9","8.4,8.3,7.9","8.3,9.5,8.8","Lleva la pantalla más grande y Apple CarPlay inalámbrico.,Ofrece la mejor garantía.,Al volante es el más comunicativo de los tres.,El motor turbo marca una diferencia total en desempeño.,Buen rendimiento de combustible. ,Alto nivel de conectividad.,Único de la categoría con asistencias de conducción.,Buenos acabados interiores.,Alto nivel de equipamiento.","El precio ha subido considerablemente.,El rendimiento de combustible puede mejorar.,Espacio interior algo justo en la banca trasera.,Acabados interiores muy sencillos.,El motor produce vibraciones.,La ergonomía tiene margen de mejora.,Al volante es cómodo, pero no propone nada.,La caja CVT no hace mucho por la dinámica.,No lleva calaveras de LED."
,,,,,,,,,,,,,,
CUPRA Ateca ,Limited Edition,9.1,8,10,10,9,10,10,10,8,7.5,8,"Elementos sutiles tanto por dentro como por fuera que lo hacen destacar aún más.,Un manejo adictivo y más parecido al de un hatch que al de un SUV.,Buen nivel de equipo.","Número limitado para México y con todos ya colocados.,Si bien es amplio, no es el más espacioso de todos.,Un precio considerablemente más alto que el de un CUPRA Ateca común."
,,,,,,,,,,,,,,
Hyundai Ioniq ,Limited,8.9,8.5,10,10,8,8,8.5,8.5,10,9,8.5,"Incluye varias asistencias de manejo desde la versión base.,Muy buen rendimiento de combustible.,Una conducción cómoda y sencilla.","El motor de combustión es ruidoso al encenderse.,La conducción es cómoda, pero sin emoción.,Los controles táctiles del tablero no transmiten la misma retroalimentación que botones normales."
Hyundai Grand i10 ,NS,7.6,7,5,7.5,8,7,8,8,10,8,7,"Es muy fácil obtener buen consumo de gasolina.,Espacio interior bien aprovechado.,La suspensión es cómoda para ciudad.","Las bocinas tienen una calidad de sonido básica.,El cinturón de seguridad central trasero es pélvico.,Sólo incluye airbags frontales y no lleva ESC."
Mitsubishi Mirage G4 ,GLS CVT,8.0,6,7,7.5,9,7,8,7,10,10,8,"Espacio interior por encima de la media.,Es muy fácil obtener un buen consumo, incluso con caja automática.,Cuenta con control electrónico de estabildad.","Acabados muy sencillos al interior.,Se extrañan airbags laterales.,Los precios del GLS se acercan a sedanes de categoría superior."
Audi Q3 Sportback ,Select 35 TFSI,8.6,9.5,8,8,8,9.5,9,9,9,8,7.5,"Un buen manejo, cómodo y bien plantado en todo momento.,Calidad de ensambles en general.","Hay elementos de seguridad que ya deberían ser de serie y no opcionales como la cámara de reversa al menos.,La caída del techo limita el espacio a lo alto en la segunda fila de asientos."
,,,,,,,,,,,,,,
Peugeot 2008 ,GT,8.8,10,9,9,8,10,9,9,8.5,8,8,"Nivel de acabados y percepción de calidad.,Manejo que es más comparable con un hatchback compacto que con un SUV,Ergonomía resultado del uso del diseño iCockpit","A pesar de ser de los más grandes de la categoría el aprovechamiento de espacio en la segunda fila puede mejorar.,Por precio nos hubiera gustado ver el freno autónomo de emergencia."
,,,,,,,,,,,,,,
Ford Escape ,Titanium,8.8,7,10,9.5,10,9,8.5,8.5,8,9,8,"Nivel de equipo de seguridad y asistencias.,Sistema Sync 3: fácil de usar, responsivo y con muchas opciones de conectividad,Manejo: gran potencia y un manejo más agradable que la media del segmento","Calidad de ensambles en distintos puntos de la cabina.,No hay opciones más accesibles con menos equipo de confort. "
Mazda 3 Hatchback ,Signature,8.8,9.5,9,9,9,9.5,10,8,8,7,8.5,"Es rápido, pero sigue siendo cómodo.,La combinación de colores y texturas en la cabina es espectacular.,Está muy bien equipado.","Poco espacio en los asientos traseros.,Para bien o para mal, no es un Mazdaspeed.,No hay puertos USB para la banca trasera."
GMC Acadia ,Denali,8.8,9,10,9.5,10,8,9,10,5,9,8,"Su marcha es cómoda y la cabina está bien insonorizado.,El nivel de equipamiento es muy alto.,Es cómodo en las tres filas de asientos.","La versión Denali no puede configurarse con siete asientos.,El consumo de combustible es alto."
Ford Escape ,SE Sport Hybrid,9.2,7,10,8,10,9,10,9,10,10,8.5,"Es fácil obtener un buen consumo de combustible.,Va hasta arriba de asistencias de seguridad.,Manejo cómodo y ágil.","Hay margen de mejora en sus ensambles.,No incluye faros de LED.,Su precio roza los 700,000 pesos."
Buick Encore GX ,Sport Touring,8.7,8.5,10,9.5,10,8,8.5,8,8.5,8,8,"Nivel de asistencias a la conducción de serie.,Opciones de conectividad y facilidad de uso del sistema de infotenimiento.,Espacio en banca trasera y cajuela","Aislamiento de sonido, a veces se cuela mucho el ruido del motor.,Calidad de marcha suave, pero con oportunidad de refinarse un poco más."
,,,,,,,,,,,,,,
,,,,,,,,,,,,,,
FIAT Argo ,HGT,7.9,8,7,8.5,8.5,8,8,7.5,8,8,7.5,"Puesta a punto de chasis pensada en los retos de la región.,Buen nivel de equipamiento tecnológico,Interior atractivo a la vista","La versión más completa sólo lleva 4 bolsas de aire.,No hay faros LED.,La dirección es muy blanda."
,,,,,,,,,,,,,,
,,,,,,,,,,,,,,
,,7.9,"8,7.7","7,8","8.5,8","8.5,8","8,10","8,10","7.5,9","8,8.5","8,7.5","7.5,8","Puesta a punto de chasis pensada en los retos de la región,Buen nivel de equipamiento tecnológico,Interior atractivo a la vista,Manejo divertido, directo y ágil,Nivel de seguridad ,Verdadero enfoque deportivo y no sólo cambios visuales","La versión más completa sólo lleva 4 bolsas de aire,No hay faros LED,La dirección es muy blanda,Suspensión muy firme para algunos,No es el más amplio en cajuela ni parte trasera,No lleva equipo realmente sorprendente para el segmento"
MG ZS ,Excite,7.9,7.5,8,8,8,8,8,5,8,9,9.5,"Precio y garantía,Nivel de equipo considerando el precio,Manejo bien plantado, de buena respuesta y cómodo","La caja de 4 cambios hace que el desempeño pierda mucha capacidad,Faltan elementos esenciales como ajuste de profundidad al volante"
,,,,,,,,,,,,,,
,,,,,,,,,,,,,,
Suzuki Ertiga ,XL7,7.7,7,6,8,8.5,7,7,7,8,10,8,"Acomoda a siete pasajeros sin demasiado esfuerzo.,El abatimiento de asientos ofrece soluciones de carga muy útiles.,La suspensión es cómoda para ciudad.","La transmisión automática no ayuda mucho al consumo.,Sólo ofrece bolsas de aire frontales.,El motor le queda muy justo con el vehículo cargado."
Chevrolet Corvette ,Z51 Performance Package,8.4,9,9,10,9,9,10,10,4,5,9,"Un deportivo de motor central por 2 millones de pesos.,Es cómodo para usarlo en ciudad.,Los acabados interiores han mejorado mucho.","Poco espacio para equipaje y objetos personales.,El V8 pasa su factura en el consumo urbano.,No ofrece freno autónomo de emergencia."
Peugeot 2008 ,GT Line,9.0,10,8.5,9,10,9,9,9,8,8.5,,"130 hp son suficientes para volverlo ágil.,Al volante es el B-SUV más divertido del momento.,Los acabados y el equipamiento son de lo mejor en la categoría.","Suspensión algo más rígida que lo usual.,El ajuste de temperatura y velocidad del A/C sólo se hace en la pantalla.,El diseño de la palanca de cambios no es igual a la del 2008 GT."
SEAT Ateca 2021 ,Xperience,8.4,8.5,8,9,9.5,8.5,9,8.5,8,7,,"Un manejo que sin estar enfocado a lo deportivo, entrega mejores sensaciones que la mayoría.,Consumos bajos si se tiene cuidado con el acelerador.,Buen nivel de conectividad y elementos de confort.","El precio no está tan bien balanceado como en otros productos.,Nos hubiera gustado ver la alerta de punto ciego y el freno autónomo de emergencia, al menos en variantes FR y Xperience.,Ciertos elementos de equipo cambian entre las versiones más completas al mismo precio."
Audi Q5 ,45 TFSI S-Line,9.1,8.5,9,10,10,9,9,10,8,8.5,8.5,"Un manejo equilibrado: ágil y cómodo.,El facelift realmente lo rejuveneció.,La gama inicia a precio competitivo.","Hay acabado negro brillante en zonas de uso diario.,Ciertas asistencias son opcionales.,Algunos plásticos cumplen a la vista, pero son rígidos al tacto."
Hyundai Grand i10 Sedán ,GLS TA,7.1,7,5,7,8,7,8,7,7.5,8,7,"Interiores bonitos y bien terminados.,Es muy cómodo para la ciudad.,El espacio interior y la cajuela están bien aprovechados.","La banca trasera es fija.,Ofrece lo mínimo en seguridad, por detrás de la competencia.,La transmisión automática le resta eficiencia. Mejor manual."
Honda Accord ,Touring,9.2,9,10,9.5,9,9,10,9,7.5,10,8.5,"El motor de 2.0 litros acelera con ganas y sin turbolag.,Su comportamiento es ágil y sedoso.,El equipamiento de confort y seguridad apunta alto.","El espacio para cabeza es el justo para conductores altos.,Las asistencias de conducción son algo nerviosas.,Honda LaneWatch no es mejor que un monitor de punto ciego."
Ford Bronco Sport ,Badlands,8.4,8,9,9.5,9,8.5,9,9,6,8,8,"Increíblemente práctico.,Puede llegar mucho más lejos que un crossover común.,Gran nivel de conectividad y elementos de confort","Consumos algo elevados.,No lleva la suite de asistencias completa.,El espacio para piernas en la parte trasera puede quedar algo reducido."
KIA Sorento ,SX,8.6,9,10,9,8,8,7,10,8,9,8,"Un diseño atractivo y fresco.,Su cuatro cilindros ahorra más fácil que un V6 con poco tráfico.,Es cómodo y fácil de conducir.","El cuadro de instrumentos digital no es mejor que uno análogo.,Mucho equipamiento se reserva sólo para el tope de gama.,El motor genera sólo el poder necesario, no más."
Mazda CX-30 ,s Grand Touring,8.4,9.5,8.5,8.5,9,9.5,10,8,5,7,8.5,"El manejo está en el punto exacto entre confort y precisión.,El motor es enérgico y de respuesta muy lineal.,La selección de materiales al interior es exquisita.","El consumo de combustible es alto.,El espacio en la banca trasera es sólo el justo.,No lleva los faros dirigibles ni el sonido Bose del CX-30 i GT."
Hyundai Creta ,Limited Turbo,8.3,8,8,8,8.5,8.5,9,8,8.5,9,7.5,"Gran amplitud en la parte trasera.,Salto en percepción de calidad.,Con motor turbo su experiencia de manejo mejora muchísimo.","El cinturón central trasero es pélvico aún.,Las variantes GL y GLS eliminan 4 bolsas de aire."
,,,,,,,,,,,,,,
